{
  "task_id": "web_fetch_status_v1",
  "environment": "web_fetch",
  "objective": "Acessar URLs, classificar resultados HTTP esperados e registrar logs enriquecidos com uso de skills.",
  "barriers_expected": ["timeout", "temporary_server_error", "unexpected_http_status"],
  "required_skills": ["classify_http_status", "validate_output_schema"],
  "recommended_skills": ["retry_with_backoff", "recover_from_timeout"],
  "min_skill_count": 2,
  "max_skill_count": 5,
  "fitness_policy": "score_by_expected_result_time_and_reliability",
  "success_criteria": [
    "Cada URL deve ser classificada conforme expected_status.",
    "O log final deve validar contra agent_log.schema.json.",
    "O agente deve registrar skill_usage_events para cada skill usada."
  ],
  "stop_criteria": [
    "Todas as URLs foram avaliadas.",
    "Timeout máximo do agente foi atingido.",
    "Fitness caiu abaixo do limite mínimo configurado."
  ],
  "inputs": {
    "urls": [
      {"url": "https://www.google.com", "expected_status": 200},
      {"url": "https://www.github.com", "expected_status": 200},
      {"url": "https://httpbin.org/status/404", "expected_status": 404}
    ]
  },
  "created_at": "2026-05-15T12:00:00Z",
  "updated_at": "2026-05-15T12:00:00Z"
}
